{
  "destinationId": "elan-valley",
  "siteId": "elan-valley-reservoir",
  "bestSiteId": "elan-valley-reservoir",
  "year": 2026,
  "month": 7,
  "algorithmVersion": "seed-fixture-calendar-0.2.0",
  "astronomyEngineVersion": "synthetic-seed",
  "generatedAt": "2026-08-20T00:00:00.000Z",
  "nights": [
    {
      "darknessRank": 1,
      "dateLocal": "2026-07-15",
      "timezone": "Europe/London",
      "astronomicalDusk": "2026-07-15T20:00:00+01:00",
      "astronomicalDawn": "2026-07-16T05:00:00+01:00",
      "moonIlluminationFraction": 0.959,
      "moonPhaseAngleDeg": 163,
      "moonRiseLocal": null,
      "moonSetLocal": null,
      "moonAltitudeMaxDeg": -6,
      "moonAboveHorizonDarkHours": 2.28,
      "moonBelowHorizonDarkHours": 3.72,
      "moonlessHours": 3.72,
      "totalDarknessHours": 6,
      "calendarDarknessScore": 48,
      "milkyWayUsefulHours": 3,
      "milkyWayStrongHours": 2.1,
      "galacticCenterAltitudeMaxDeg": 27,
      "milkyWayOpportunityScore": 48
    }
  ]
}
