{
  "destinationId": "hortobagy",
  "siteId": "hortobagy-dark-sky",
  "bestSiteId": "hortobagy-dark-sky",
  "year": 2026,
  "month": 2,
  "algorithmVersion": "seed-fixture-calendar-0.2.0",
  "astronomyEngineVersion": "synthetic-seed",
  "generatedAt": "2026-08-20T00:00:00.000Z",
  "nights": [
    {
      "darknessRank": 1,
      "dateLocal": "2026-02-15",
      "timezone": "Europe/Budapest",
      "astronomicalDusk": "2026-02-15T20:00:00+01:00",
      "astronomicalDawn": "2026-02-16T05:00:00+01:00",
      "moonIlluminationFraction": 0.274,
      "moonPhaseAngleDeg": 98,
      "moonRiseLocal": null,
      "moonSetLocal": null,
      "moonAltitudeMaxDeg": -16,
      "moonAboveHorizonDarkHours": 4.18,
      "moonBelowHorizonDarkHours": 6.82,
      "moonlessHours": 6.82,
      "totalDarknessHours": 11,
      "calendarDarknessScore": 88,
      "milkyWayUsefulHours": 5.5,
      "milkyWayStrongHours": 3.85,
      "galacticCenterAltitudeMaxDeg": 22,
      "milkyWayOpportunityScore": 88
    }
  ]
}
